{
  "$schema": "https://json-schema.org/draft/2020-12/schema",
  "$id": "https://github.com/Alisa007/business-obligations/schema/cities.schema.json",
  "title": "City rule data (one file per state)",
  "type": "array",
  "items": {
    "type": "object",
    "additionalProperties": false,
    "required": ["city", "items"],
    "properties": {
      "city": {
        "type": "string",
        "minLength": 2,
        "pattern": "^\\S(.*\\S)?$"
      },
      "aliases": {
        "type": "array",
        "minItems": 1,
        "uniqueItems": true,
        "items": {
          "type": "string",
          "minLength": 2
        }
      },
      "status": {
        "enum": ["rules", "none", "unverified"]
      },
      "checkedOn": {
        "$ref": "common.schema.json#/$defs/isoDate",
        "description": "Date (YYYY-MM-DD) the entry was checked against official pages. Absent = never individually checked."
      },
      "sourceUrl": {
        "$ref": "common.schema.json#/$defs/httpsUrlOrList"
      },
      "reason": {
        "type": "string",
        "pattern": "^[a-z0-9]+(-[a-z0-9]+)*$",
        "description": "Code of a shared explanation in data/local-notes.json, for notes that several entries have in common."
      },
      "note": {
        "type": "string",
        "minLength": 10,
        "pattern": "^\\S(.*[.)])$"
      },
      "items": {
        "type": "array",
        "items": {
          "$ref": "local-item.schema.json"
        }
      },
      "counties": {
        "type": "array",
        "minItems": 1,
        "uniqueItems": true,
        "items": {
          "type": "string",
          "minLength": 2
        }
      }
    },
    "allOf": [
      {
        "not": {
          "required": ["note", "reason"]
        }
      },
      {
        "if": {
          "properties": {
            "items": {
              "minItems": 1
            }
          }
        },
        "then": {
          "not": {
            "required": ["status"],
            "properties": {
              "status": {
                "enum": ["none", "unverified"]
              }
            }
          }
        }
      },
      {
        "if": {
          "properties": {
            "items": {
              "maxItems": 0
            }
          }
        },
        "then": {
          "required": ["status"]
        }
      },
      {
        "if": {
          "required": ["status"],
          "properties": {
            "status": {
              "const": "none"
            }
          }
        },
        "then": {
          "required": ["sourceUrl", "checkedOn"]
        }
      }
    ]
  }
}
