[
  {
    "city": "Kansas City",
    "counties": ["Wyandotte"],
    "items": [
      {
        "id": "kansascity-ks.occupation-tax-license",
        "title": "Renew Kansas City, Kansas occupation tax license",
        "category": "license",
        "authority": "Unified Government of Wyandotte County and Kansas City, Kansas, Business License Division",
        "description": "Businesses and services in Kansas City, Kansas need an occupation tax license; the licensing year runs January 1 to December 31, and a zoning application comes first for physical locations.",
        "frequency": "annual",
        "deadline": "Licensing year ends December 31",
        "url": "https://www.wycokck.org/Departments/Neighborhood-Resource-Center/Business-License/Business-Licenses-and-Permits",
        "appliesTo": ["all"]
      }
    ],
    "checkedOn": "2026-10-13"
  },
  {
    "city": "Olathe",
    "status": "none",
    "sourceUrl": "https://www.olatheks.gov/government/city-clerk/opening-a-new-business",
    "note": "The City Clerk says the city does not require a general business license; liquor, massage, pawnbroker, payday-loan, taxi and tow businesses are licensed.",
    "counties": ["Johnson"],
    "items": [],
    "checkedOn": "2026-10-13"
  },
  {
    "city": "Overland Park",
    "status": "none",
    "sourceUrl": "https://kslegislature.gov/li_2022/b2021_22/committees/ctte_s_cmrce_1/documents/testimony/20210127_16.pdf",
    "note": "City testimony to the Kansas Senate states the city has no general business license and uses specific occupational licenses (massage, pawn, scrap metal, payday lenders, taxis and others).",
    "counties": ["Johnson"],
    "items": [],
    "checkedOn": "2026-10-13"
  },
  {
    "city": "Topeka",
    "status": "none",
    "sourceUrl": "https://www.topeka.org/cityclerk/?p=46",
    "note": "The City Clerk says the city does not issue general business licenses; specific regulated activities require a license or occupation tax.",
    "counties": ["Shawnee"],
    "items": [],
    "checkedOn": "2026-10-13"
  },
  {
    "city": "Wichita",
    "status": "none",
    "sourceUrl": "https://www.wichita.gov/344",
    "note": "The city does not require a standard business license for all businesses, only for certain activities listed on its Business Licenses page.",
    "counties": ["Sedgwick"],
    "items": [],
    "checkedOn": "2026-10-13"
  }
]
