[
  {
    "city": "Charleston",
    "counties": ["Kanawha"],
    "items": [
      {
        "id": "charleston-wv.business-registration",
        "title": "Complete the City of Charleston business registration application",
        "category": "registration",
        "authority": "City of Charleston Office of the City Collector",
        "description": "Every business or individual doing business in Charleston must complete the Business Registration Application, whether or not it has a permanent location in the city. Inspection approval from the Planning/Zoning, Building and Fire departments comes first.",
        "frequency": "once",
        "url": "https://charlestonwv.gov/node/143",
        "appliesTo": ["all"]
      },
      {
        "id": "charleston-wv.b-and-o-tax",
        "title": "File and pay the City of Charleston Business and Occupation tax",
        "category": "payment",
        "authority": "City of Charleston Office of the City Collector",
        "description": "The city levies a Business and Occupation privilege tax on business activity within city limits. Returns and rates are set out in the city's B&O Tax Overview.",
        "frequency": "ongoing",
        "url": "https://charlestonwv.gov/node/143",
        "appliesTo": ["all"]
      },
      {
        "id": "charleston-wv.city-service-fee",
        "title": "Remit the Charleston City Service Fee withheld from employees",
        "category": "payment",
        "authority": "City of Charleston Office of the City Collector",
        "description": "Employers withhold a $3.00 per week City Service Fee from covered employees and remit it quarterly. Self-employed individuals pay it themselves.",
        "rrule": "FREQ=YEARLY;BYMONTH=1,4,7,10;BYMONTHDAY=-1",
        "deadline": "Within one month after each calendar quarter ends",
        "url": "https://charlestonwv.gov/node/143",
        "appliesTo": ["employees", "unincorporated"]
      }
    ],
    "checkedOn": "2026-10-15"
  },
  {
    "city": "Huntington",
    "counties": ["Cabell", "Wayne"],
    "items": [
      {
        "id": "huntington-wv.business-license",
        "title": "Obtain and renew the Huntington business license",
        "category": "license",
        "authority": "City of Huntington Finance Division",
        "description": "Anyone conducting business in the City of Huntington must obtain a Huntington Business License. The page gives a $20 fee, notes that fees vary by license type and are not prorated, and says the license term runs July 1 to June 30 with a renewal notice sent around the first of June.",
        "frequency": "annual",
        "deadline": "License term July 1 to June 30",
        "url": "https://www.cityofhuntington.com/business/new-business/license/",
        "appliesTo": ["all"],
        "feeDetail": {
          "basis": "varies",
          "min": 20.0
        }
      },
      {
        "id": "huntington-wv.b-and-o-tax",
        "title": "File the City of Huntington Business & Occupation tax return",
        "category": "filing",
        "authority": "City of Huntington Finance Division",
        "description": "Any business engaged in activity with the object of gaining economic benefit files a quarterly B&O return listing gross income for the period, including a return showing no activity when there was none. The page does not state a rate and notes that the Retail, Restaurant & Others classification was waived on September 13, 2021.",
        "frequency": "quarterly",
        "deadline": "30 days after each filing period ends (periods end March 31, June 30, September 30 and December 31)",
        "url": "https://www.cityofhuntington.com/business/taxes-and-fees/b-o-tax/",
        "appliesTo": ["all"]
      }
    ],
    "checkedOn": "2026-10-16"
  }
]
