[
  {
    "city": "Lincoln",
    "status": "rules",
    "note": "The city levies occupation taxes on specific activities (for example telecommunications); a general business license was not confirmed.",
    "counties": ["Lancaster"],
    "items": [
      {
        "id": "lincoln.local-licenses",
        "title": "Review applicable local licenses and permits in Lincoln",
        "category": "license",
        "authority": "Lincoln local licensing authority",
        "description": "Review the cited local licensing source before operating; requirements may be activity-specific and can differ by business type or location.",
        "frequency": "once",
        "url": [
          "https://www.lincoln.ne.gov/City/Departments/Finance/City-Treasurer/Occupation-Taxes?lang_update=639161852326117604"
        ],
        "appliesTo": ["all"],
        "feeDetail": {
          "basis": "unknown"
        },
        "penalty": {
          "basis": "unknown"
        }
      }
    ],
    "checkedOn": "2026-10-18",
    "sourceUrl": [
      "https://www.lincoln.ne.gov/City/Departments/Finance/City-Treasurer/Occupation-Taxes?lang_update=639161852326117604"
    ]
  },
  {
    "city": "Omaha",
    "status": "rules",
    "note": "The city levies occupation taxes on specific activities (for example restaurants and hotels); no general business license was confirmed.",
    "counties": ["Douglas"],
    "items": [
      {
        "id": "omaha.local-licenses",
        "title": "Review applicable local licenses and permits in Omaha",
        "category": "license",
        "authority": "Omaha local licensing authority",
        "description": "Review the cited local licensing source before operating; requirements may be activity-specific and can differ by business type or location.",
        "frequency": "once",
        "url": ["https://onebiz.cityofomaha.org/obtain-necessary-licenses-and-permits"],
        "appliesTo": ["all"],
        "feeDetail": {
          "basis": "unknown"
        },
        "penalty": {
          "basis": "unknown"
        }
      }
    ],
    "checkedOn": "2026-10-18",
    "sourceUrl": ["https://onebiz.cityofomaha.org/obtain-necessary-licenses-and-permits"]
  },
  {
    "city": "Bellevue",
    "status": "rules",
    "reason": "city-license-unconfirmed",
    "items": [
      {
        "id": "bellevue.local-licenses",
        "title": "Review applicable local licenses and permits in Bellevue",
        "category": "license",
        "authority": "Bellevue local licensing authority",
        "description": "Bellevue issues city licenses and permits through the City Clerk for regulated activities including liquor, tobacco, trash hauling, pawnbroking, vendors and solicitors, events, fireworks, and vending-machine or distributor occupation-tax stickers; construction and trade licenses use separate city applications and permits.",
        "url": ["https://www.bellevue.net/278/City-Clerk"],
        "frequency": "once",
        "appliesTo": ["all"],
        "feeDetail": {
          "basis": "unknown"
        },
        "penalty": {
          "basis": "unknown"
        }
      }
    ],
    "checkedOn": "2026-10-18",
    "sourceUrl": ["https://sos.nebraska.gov/business-services/business-services-division"]
  },
  {
    "city": "Grand Island",
    "status": "rules",
    "reason": "city-license-unconfirmed",
    "items": [
      {
        "id": "grand-island.local-licenses",
        "title": "Review applicable local licenses and permits in Grand Island",
        "category": "license",
        "authority": "Grand Island local licensing authority",
        "description": "Grand Island’s official business resources identify city-issued permits and licenses such as liquor licenses, pawnbroker permits, vendor-related permits, and garbage-hauler permits; businesses should use the city’s Business and City Clerk resources to confirm the permit required for their activity before operating.",
        "url": ["https://www.grand-island.com/permits"],
        "frequency": "once",
        "appliesTo": ["all"],
        "feeDetail": {
          "basis": "unknown"
        },
        "penalty": {
          "basis": "unknown"
        }
      }
    ],
    "checkedOn": "2026-10-18",
    "sourceUrl": ["https://sos.nebraska.gov/business-services/business-services-division"]
  }
]
