[
  {
    "city": "Burlington",
    "status": "rules",
    "counties": ["Chittenden"],
    "note": "Burlington’s new-business materials identify municipal licensing or tax requirements for activities such as restaurants, hotels, amusements and admissions; confirm the applicable city filing before operating.",
    "sourceUrl": ["https://www.burlingtonvt.gov/DocumentCenter/View/690/Opening-a-New-Business---Application-PDF"],
    "items": [
      {
        "id": "burlington.activity-license",
        "title": "Confirm Burlington activity-specific city licenses and taxes",
        "category": "license",
        "authority": "City of Burlington Clerk and Treasurer",
        "description": "Burlington’s new-business materials identify municipal licensing or tax requirements for activities such as restaurants, hotels, amusements and admissions; confirm the applicable city filing before operating.",
        "frequency": "once",
        "url": ["https://www.burlingtonvt.gov/DocumentCenter/View/690/Opening-a-New-Business---Application-PDF"],
        "appliesTo": ["all"]
      }
    ],
    "checkedOn": "2026-10-18"
  },
  {
    "city": "Montpelier",
    "counties": ["Washington"],
    "checkedOn": "2026-10-18",
    "sourceUrl": ["https://www.montpelier-vt.org/1474/Notices-to-Taxpayers-Archive"],
    "items": [
      {
        "id": "montpelier-vt.business-personal-property-report",
        "title": "File the Montpelier business personal property report",
        "category": "filing",
        "authority": "City of Montpelier Assessor",
        "description": "Montpelier asks business owners to file a business personal property report with the Assessor each year by April 20, the date Vermont's lister calendar sets for business personal property forms (32 V.S.A. section 3618). The state's 2020 list shows Montpelier taxes business machinery and equipment but not inventory.",
        "rrule": "FREQ=YEARLY;BYMONTH=4;BYMONTHDAY=20",
        "url": ["https://www.montpelier-vt.org/1474/Notices-to-Taxpayers-Archive"],
        "appliesTo": ["all"]
      }
    ]
  }
]
