[
  {
    "city": "Billings",
    "counties": ["Yellowstone"],
    "items": [
      {
        "id": "billings.business-license",
        "title": "Hold a Billings business license",
        "category": "license",
        "authority": "City of Billings Finance Department",
        "description": "Anyone doing business in or based in Billings must hold a city business license on or before the day the business starts, one per business type and location; home-based businesses are included.",
        "frequency": "ongoing",
        "url": ["https://billingsmt.gov/981/Business-Licenses"],
        "appliesTo": ["all"],
        "feeDetail": {
          "basis": "unknown"
        },
        "penalty": {
          "basis": "unknown"
        }
      }
    ],
    "checkedOn": "2026-10-18",
    "sourceUrl": ["https://www.billingsmt.gov/981/Business-Licenses"]
  },
  {
    "city": "Missoula",
    "status": "rules",
    "reason": "city-license-unconfirmed",
    "items": [
      {
        "id": "missoula.local-licenses",
        "title": "Review applicable local licenses and permits in Missoula",
        "category": "license",
        "authority": "Missoula local licensing authority",
        "description": "Use the cited official state business resource as a starting point, then confirm city and county licensing requirements before operating.",
        "frequency": "once",
        "url": ["https://help.sosmt.gov/en/article/how-do-i-register-as-a-sole-proprietor-gpqio4/"],
        "appliesTo": ["all"],
        "feeDetail": {
          "basis": "unknown"
        },
        "penalty": {
          "basis": "unknown"
        }
      }
    ],
    "checkedOn": "2026-10-18",
    "sourceUrl": ["https://help.sosmt.gov/en/article/how-do-i-register-as-a-sole-proprietor-gpqio4/"]
  },
  {
    "city": "Great Falls",
    "status": "rules",
    "reason": "city-license-unconfirmed",
    "items": [
      {
        "id": "great-falls.local-licenses",
        "title": "Review applicable local licenses and permits in Great Falls",
        "category": "license",
        "authority": "Great Falls local licensing authority",
        "description": "Use the cited official state business resource as a starting point, then confirm city and county licensing requirements before operating.",
        "frequency": "once",
        "url": ["https://help.sosmt.gov/en/article/how-do-i-register-as-a-sole-proprietor-gpqio4/"],
        "appliesTo": ["all"],
        "feeDetail": {
          "basis": "unknown"
        },
        "penalty": {
          "basis": "unknown"
        }
      }
    ],
    "checkedOn": "2026-10-18",
    "sourceUrl": ["https://help.sosmt.gov/en/article/how-do-i-register-as-a-sole-proprietor-gpqio4/"]
  },
  {
    "city": "Bozeman",
    "status": "rules",
    "reason": "city-license-unconfirmed",
    "items": [
      {
        "id": "bozeman.local-licenses",
        "title": "Review applicable local licenses and permits in Bozeman",
        "category": "license",
        "authority": "Bozeman local licensing authority",
        "description": "Use the cited official state business resource as a starting point, then confirm city and county licensing requirements before operating.",
        "frequency": "once",
        "url": ["https://help.sosmt.gov/en/article/how-do-i-register-as-a-sole-proprietor-gpqio4/"],
        "appliesTo": ["all"],
        "feeDetail": {
          "basis": "unknown"
        },
        "penalty": {
          "basis": "unknown"
        }
      }
    ],
    "checkedOn": "2026-10-18",
    "sourceUrl": ["https://help.sosmt.gov/en/article/how-do-i-register-as-a-sole-proprietor-gpqio4/"]
  }
]
