[
  {
    "city": "Portland",
    "status": "rules",
    "counties": ["Cumberland"],
    "note": "Portland’s Business License Administrator coordinates applications and interdepartmental approvals under licensing ordinances; requirements are activity-specific, so confirm the applicable license before operating.",
    "sourceUrl": ["https://www.portlandmaine.gov/business"],
    "items": [
      {
        "id": "portland.activity-license",
        "title": "Confirm Portland activity-specific business licensing",
        "category": "license",
        "authority": "City of Portland Business License Administrator",
        "description": "Portland’s Business License Administrator coordinates applications and interdepartmental approvals under licensing ordinances; requirements are activity-specific, so confirm the applicable license before operating.",
        "frequency": "once",
        "url": ["https://www.portlandmaine.gov/business"],
        "appliesTo": ["all"],
        "feeDetail": {
          "basis": "unknown"
        },
        "penalty": {
          "basis": "not_stated",
          "note": "The city's published pages for this item give no late-penalty amount."
        }
      }
    ],
    "checkedOn": "2026-10-18"
  }
]
