[
  {
    "city": "Washington",
    "status": "none",
    "sourceUrl": ["https://dlcp.dc.gov/node/1618236"],
    "note": "The District is both city and state: its Basic Business License is covered by the state-level rules, with no separate city layer.",
    "aliases": ["Washington DC", "Washington, D.C."],
    "items": [],
    "checkedOn": "2026-10-13",
    "counties": ["District of Columbia"]
  }
]
