[
  {
    "city": "Cary",
    "status": "none",
    "sourceUrl": "https://canons.sog.unc.edu/blog/2014/05/30/the-axe-finally-falls-on-local-privilege-license-taxes/",
    "reason": "nc-no-privilege-license-tax",
    "counties": ["Wake", "Chatham"],
    "items": [],
    "checkedOn": "2026-10-13"
  },
  {
    "city": "Charlotte",
    "status": "none",
    "sourceUrl": "https://canons.sog.unc.edu/blog/2014/05/30/the-axe-finally-falls-on-local-privilege-license-taxes/",
    "reason": "nc-no-privilege-license-tax",
    "counties": ["Mecklenburg"],
    "items": [],
    "checkedOn": "2026-10-13"
  },
  {
    "city": "Concord",
    "status": "none",
    "sourceUrl": "https://canons.sog.unc.edu/blog/2014/05/30/the-axe-finally-falls-on-local-privilege-license-taxes/",
    "reason": "nc-no-privilege-license-tax",
    "counties": ["Cabarrus"],
    "items": [],
    "checkedOn": "2026-10-13"
  },
  {
    "city": "Durham",
    "status": "none",
    "sourceUrl": "https://canons.sog.unc.edu/blog/2014/05/30/the-axe-finally-falls-on-local-privilege-license-taxes/",
    "reason": "nc-no-privilege-license-tax",
    "counties": ["Durham", "Wake"],
    "items": [],
    "checkedOn": "2026-10-13"
  },
  {
    "city": "Fayetteville",
    "status": "none",
    "sourceUrl": "https://canons.sog.unc.edu/blog/2014/05/30/the-axe-finally-falls-on-local-privilege-license-taxes/",
    "reason": "nc-no-privilege-license-tax",
    "counties": ["Cumberland"],
    "items": [],
    "checkedOn": "2026-10-13"
  },
  {
    "city": "Greensboro",
    "status": "none",
    "sourceUrl": "https://canons.sog.unc.edu/blog/2014/05/30/the-axe-finally-falls-on-local-privilege-license-taxes/",
    "reason": "nc-no-privilege-license-tax",
    "counties": ["Guilford"],
    "items": [],
    "checkedOn": "2026-10-13"
  },
  {
    "city": "Raleigh",
    "status": "none",
    "sourceUrl": "https://canons.sog.unc.edu/blog/2014/05/30/the-axe-finally-falls-on-local-privilege-license-taxes/",
    "reason": "nc-no-privilege-license-tax",
    "counties": ["Wake"],
    "items": [],
    "checkedOn": "2026-10-13"
  },
  {
    "city": "Wilmington",
    "status": "none",
    "sourceUrl": "https://canons.sog.unc.edu/blog/2014/05/30/the-axe-finally-falls-on-local-privilege-license-taxes/",
    "reason": "nc-no-privilege-license-tax",
    "counties": ["New Hanover"],
    "items": [],
    "checkedOn": "2026-10-13"
  },
  {
    "city": "Winston-Salem",
    "status": "none",
    "sourceUrl": "https://canons.sog.unc.edu/blog/2014/05/30/the-axe-finally-falls-on-local-privilege-license-taxes/",
    "reason": "nc-no-privilege-license-tax",
    "counties": ["Forsyth"],
    "items": [],
    "checkedOn": "2026-10-13"
  }
]
