[
  {
    "city": "Manchester",
    "counties": ["Hillsborough"],
    "items": [
      {
        "id": "manchester-nh.business-license",
        "title": "Renew Manchester business license",
        "category": "license",
        "authority": "City of Manchester City Clerk, Business Licensing and Enforcement",
        "description": "Licenses are obtained from the City Clerk; the licensing year begins May 1 and licenses expire April 30 of the following year.",
        "rrule": "FREQ=YEARLY;BYMONTH=4;BYMONTHDAY=30",
        "url": "https://www.manchesternh.gov/Departments/City-Clerk/Licenses-and-Permits/Business-License",
        "appliesTo": ["all"]
      }
    ],
    "checkedOn": "2026-10-18",
    "sourceUrl": "https://www.manchesternh.gov/Departments/City-Clerk/Licenses-and-Permits/Business-License"
  },
  {
    "city": "Nashua",
    "status": "rules",
    "reason": "city-license-unconfirmed",
    "items": [
      {
        "id": "nashua.local-licenses",
        "title": "Review applicable local licenses and permits in Nashua",
        "category": "license",
        "authority": "Nashua local licensing authority",
        "description": "Use the cited official state business resource as a starting point, then confirm city and county licensing requirements before operating.",
        "frequency": "once",
        "url": "https://www.sos.nh.gov/corporations-0/forms-and-fees/trade-names",
        "appliesTo": ["all"]
      }
    ],
    "checkedOn": "2026-10-18",
    "sourceUrl": "https://www.sos.nh.gov/corporations-0/forms-and-fees/trade-names"
  },
  {
    "city": "Concord",
    "status": "rules",
    "reason": "city-license-unconfirmed",
    "items": [
      {
        "id": "concord.local-licenses",
        "title": "Review applicable local licenses and permits in Concord",
        "category": "license",
        "authority": "Concord local licensing authority",
        "description": "Use the cited official state business resource as a starting point, then confirm city and county licensing requirements before operating.",
        "frequency": "once",
        "url": "https://www.sos.nh.gov/corporations-0/forms-and-fees/trade-names",
        "appliesTo": ["all"]
      }
    ],
    "checkedOn": "2026-10-18",
    "sourceUrl": "https://www.sos.nh.gov/corporations-0/forms-and-fees/trade-names"
  }
]
