[
  {
    "city": "Lexington",
    "note": "The due dates of the net profits return and of the employer returns were not stated on the city's pages; they are in its yearly due-dates notice.",
    "counties": ["Fayette"],
    "items": [
      {
        "id": "lexington.net-profits-license-fee-return",
        "title": "File the Lexington net profits license fee return",
        "category": "filing",
        "authority": "Lexington-Fayette Urban County Government Division of Revenue",
        "description": "Every business entity, including sole proprietors unless the IRS has issued a tax-exempt determination letter, files a net profits license fee return (Form 228) each year and pays the occupational license fee of 2.25% of net profits. The $100 annual minimum is paid with the return, except that individuals and sole proprietors with gross receipts of $4,400 or less owe no minimum for that year and the next but must still file.",
        "rrule": "FREQ=YEARLY",
        "deadline": "On the due date the city publishes each year for Form 228",
        "url": "https://www.lexingtonky.gov/working/business-licensing-taxes/occupational-license-fee-minimum-license-filing-requirements",
        "appliesTo": ["all"]
      },
      {
        "id": "lexington.employer-license-fee-withholding",
        "title": "Withhold and remit the Lexington occupational license fee on wages",
        "category": "payment",
        "authority": "Lexington-Fayette Urban County Government Division of Revenue",
        "description": "Employers withhold the 2.25% occupational license fee from employees' compensation and file the Employer's Return of License Fee Withheld each quarter, or each month once the fee withheld in any quarter exceeds $300. An annual reconciliation of the fee withheld is also filed.",
        "rrule": "FREQ=MONTHLY;INTERVAL=3",
        "deadline": "Quarterly (monthly above $300 withheld in a quarter), plus an annual reconciliation",
        "url": "https://www.lexingtonky.gov/working/business-licensing-taxes/occupational-license-fee-minimum-license-filing-requirements",
        "appliesTo": ["employees"]
      }
    ],
    "checkedOn": "2026-10-18",
    "sourceUrl": "https://www.lexingtonky.gov/working/business-licensing-taxes/how-start-business-lexington"
  },
  {
    "city": "Louisville",
    "counties": ["Jefferson"],
    "sourceUrl": "https://louisvilleky.gov/government/landing-page/get-license",
    "items": [
      {
        "id": "louisville.occupational-license-net-profits",
        "title": "File Louisville Metro occupational license tax net profits return (OL-3)",
        "category": "filing",
        "authority": "Louisville Metro Revenue Commission",
        "description": "Businesses engaged in business in Louisville Metro (all of Jefferson County) pay the occupational license tax of 2.2% on net profits and file Form OL-3. The return is due the 15th day of the fourth month after the fiscal year ends (April 15 for calendar-year filers), with an automatic six-month extension on Form OL-3EXT filed by the original due date; tax due is still payable by then. A business whose tax exceeds $5,000 pays quarterly estimates, except sole proprietors and a business in its first year.",
        "rrule": "FREQ=YEARLY;BYMONTH=4;BYMONTHDAY=15",
        "deadlineNote": "calendar-year filers",
        "url": "https://louisvilleky.gov/sites/default/files/2024-12/ol-3d_instructions_2025.pdf",
        "appliesTo": ["all"],
        "feeDetail": {
          "basis": "percent",
          "rate": 2.2,
          "note": "of net profits"
        },
        "checkedOn": "2026-10-18"
      },
      {
        "id": "louisville.occupational-license-withholding",
        "title": "Register for and withhold Louisville occupational license tax (W-1)",
        "category": "registration",
        "authority": "Louisville Metro Revenue Commission",
        "description": "An employer withholds the occupational license tax (2.2% for Louisville residents, 1.45% for non-resident individuals) from wages earned in Louisville Metro and files Form W-1 by the last day of the month after each calendar quarter. An employer that withheld more than $3,000 in any of the four preceding quarters also deposits monthly, by the 15th of the following month, on Form W-1D.",
        "rrule": "FREQ=YEARLY;BYMONTH=1,4,7,10;BYMONTHDAY=-1",
        "url": "https://louisvilleky.gov/sites/default/files/2026-01/W-1D_Form_2025.pdf",
        "appliesTo": ["employees"],
        "checkedOn": "2026-10-18"
      }
    ]
  },
  {
    "city": "Lexington-Fayette",
    "status": "rules",
    "reason": "city-license-unconfirmed",
    "items": [
      {
        "id": "lexington-fayette.local-licenses",
        "title": "Review applicable local licenses and permits in Lexington-Fayette",
        "category": "license",
        "authority": "Lexington-Fayette local licensing authority",
        "description": "Use the cited official state business resource as a starting point, then confirm city and county licensing requirements before operating.",
        "frequency": "once",
        "url": "https://web.sos.ky.gov/forms/corp/ASN-Certificate%20of%20Assumed%20Name.pdf",
        "appliesTo": ["all"]
      }
    ],
    "checkedOn": "2026-10-18",
    "sourceUrl": "https://web.sos.ky.gov/forms/corp/ASN-Certificate%20of%20Assumed%20Name.pdf"
  },
  {
    "city": "Bowling Green",
    "status": "rules",
    "reason": "city-license-unconfirmed",
    "items": [
      {
        "id": "bowling-green.local-licenses",
        "title": "Review applicable local licenses and permits in Bowling Green",
        "category": "license",
        "authority": "Bowling Green local licensing authority",
        "description": "Use the cited official state business resource as a starting point, then confirm city and county licensing requirements before operating.",
        "frequency": "once",
        "url": "https://web.sos.ky.gov/forms/corp/ASN-Certificate%20of%20Assumed%20Name.pdf",
        "appliesTo": ["all"]
      }
    ],
    "checkedOn": "2026-10-18",
    "sourceUrl": "https://web.sos.ky.gov/forms/corp/ASN-Certificate%20of%20Assumed%20Name.pdf"
  },
  {
    "city": "Owensboro",
    "status": "rules",
    "reason": "city-license-unconfirmed",
    "items": [
      {
        "id": "owensboro.local-licenses",
        "title": "Review applicable local licenses and permits in Owensboro",
        "category": "license",
        "authority": "Owensboro local licensing authority",
        "description": "Use the cited official state business resource as a starting point, then confirm city and county licensing requirements before operating.",
        "frequency": "once",
        "url": "https://web.sos.ky.gov/forms/corp/ASN-Certificate%20of%20Assumed%20Name.pdf",
        "appliesTo": ["all"]
      }
    ],
    "checkedOn": "2026-10-18",
    "sourceUrl": "https://web.sos.ky.gov/forms/corp/ASN-Certificate%20of%20Assumed%20Name.pdf"
  },
  {
    "city": "Covington",
    "status": "rules",
    "reason": "city-license-unconfirmed",
    "items": [
      {
        "id": "covington.local-licenses",
        "title": "Review applicable local licenses and permits in Covington",
        "category": "license",
        "authority": "Covington local licensing authority",
        "description": "Use the cited official state business resource as a starting point, then confirm city and county licensing requirements before operating.",
        "frequency": "once",
        "url": "https://web.sos.ky.gov/forms/corp/ASN-Certificate%20of%20Assumed%20Name.pdf",
        "appliesTo": ["all"]
      }
    ],
    "checkedOn": "2026-10-18",
    "sourceUrl": "https://web.sos.ky.gov/forms/corp/ASN-Certificate%20of%20Assumed%20Name.pdf"
  }
]
